{
  "schema_version": "1.0",
  "checkpoint_id": "CP-STAGE03C-VERIFIED",
  "project_id": "devflow",
  "created_at": "2026-10-27T20:04:24.953482+00:00",
  "reason": "stage_completed",
  "safe_to_resume": true,
  "snapshot": {
    "stage_id": "STAGE-03",
    "work_id": "WORK-03-04",
    "git_head_sha": "ae0054d007685265ba1bfbad81b4813e7b25537a",
    "server_deployments": {},
    "last_action": "stage3c_authenticated_public_mcp_verified",
    "next_action": "plan_stage4_controlled_execution",
    "public_mcp_resource": "https://srun.ir/mcpdevflow",
    "oauth_issuer": "https://dev-fqzv1aqwljc7mhwz.us.auth0.com/",
    "live_probe_at_epoch": 1793131071.528535,
    "tools_verified": 8,
    "config_sha256": "1b8c3c0176814fd930e8bc68e0d720f62edf1f1369ab5a082a643ae48aab2913",
    "note": "HTTPS discovery, bearer denial, authenticated read-only MCP tools, cross-project denial, and immediate principal revocation were observed. The client is M2M only; user OAuth and target deployment health are unverified. Git SHA is the parent before this milestone commit."
  },
  "do_not_repeat": [
    "create_github_repository",
    "commit_stage0",
    "push_stage0",
    "bind_control_server_address",
    "run_stage1_bootstrap_on_control_server",
    "install_stage1",
    "implement_stage2_execution_leases",
    "implement_local_identity_and_encrypted_vault",
    "implement_and_enroll_restricted_local_agent",
    "configure_authenticated_https_mcp_transport"
  ]
}
