{
  "schema_version": "1.0",
  "checkpoint_id": "CP-STAGE03A-VERIFIED",
  "project_id": "devflow",
  "created_at": "2026-10-25T17:13:43.124734+00:00",
  "reason": "work_completed",
  "safe_to_resume": true,
  "snapshot": {
    "stage_id": "STAGE-03",
    "work_id": "WORK-03-02",
    "git_head_sha": "a3b027c487f9a6c729f5d6a1e894ea93e0d82358",
    "server_deployments": {},
    "last_action": "stage3a_local_identity_and_vault_verified",
    "next_action": "configure_stage3_remote_agent_and_authenticated_transport",
    "note": "Local identity, project-scoped stdio checks and encrypted vault verified by operator-run tests. Stage 3 remains ACTIVE; remote agent, OAuth, network endpoint and live deployment health remain unverified. Git HEAD is the observed parent before this milestone commit."
  },
  "do_not_repeat": [
    "create_github_repository",
    "commit_stage0",
    "push_stage0",
    "bind_control_server_address",
    "run_stage1_bootstrap_on_control_server",
    "install_stage1",
    "implement_stage2_execution_leases",
    "implement_local_identity_and_encrypted_vault"
  ]
}
